<?xml version="1.0" encoding="utf-8"?>
<!DOCTYPE documento SYSTEM "../document.dtd">
<documento>
    <typo>Traductiones</typo>
    <data>20180115</data>
    <incatenar>
        <veni>https://interlingua.pedroruizhidalgo.es/leger</veni>
    </incatenar>
    <taxinomia>Le violentia es un crimine</taxinomia>
    <autores>
        <autor>
            <nomine>Carmelo Serraino</nomine>
            <retes>melo serraino</retes>
        </autor>
    </autores>
    <contento>
        <titulo>Le violentia es un crimine. Ma la corte insistente o inhabile non es un delicto, ni le galanteria
amorose es un aggression machiste.</titulo>
        <imagine>https://interlingua.pedroruizhidalgo.es/assets/image/Deneuve.jpg</imagine>
        <texto>/boldDepost le affaire Weinstein ha habite loco un justificate prisa de conscientia del violentias sexual exercite sur le feminas, particularmente in le quadro professional, ubi alcunes abusava de lor poter. Illo era necessari. Ma iste liberation del parola se retorna hodie in su contrario: on nos intima de parlar como il conveni, de tacer lo que  de irate, e illas que refusa de se plicar a tal injunctiones son reguardate como traitrices, complices!bold/

Ora es justo le characteristica del puritanismo facer se prestar, a nomine de un pretendite ben general, le argumentos del protection del feminas e de lor emancipation pro melio las attachar con un catena a un stato juridic de eterne victimas, paupere parve cosas sub le ascendente de demones phallocrate, como al bon vetere tempore del magia.

/em/boldDelationes e posas in stato de accusationbold/em/

De facto, #metoo a trainate in le pressa e sur le retes social un campania de delationes e de posas in accusation public de individuos qui, sin que on lor lassa la possibilitate ni de responder ni de se defender, ha essite mittite exactemente sur le mesme plano del aggressores sexual. Iste justitia expeditive ha jam su victimas, homines sanctionate al exercitio de lor mestiero, obligate al dimission, et cetera, quando illes non ha habite que le sol torto de haber toccate un genu, tentate de furar un basio, parlate de cosas «intime» al tempore de un prandio professional o de haber inviate del messages a connotation sexual a un femina cuje le attraction non era reciproc.

Iste febre a expedir le «porcos» al abattitorio, distante de adjutar le feminas a se render autonome, servi in realitate le interesses del inimicos del libertate sexual, del extremistas religiose, del pejor reactionarios e de illes qui estima, in nomine de un conception substantial del ben e del moral victorian que va insimul a que: le feminas son del individuos «a parte», infantes a visage de adulte, personas reclamante de esser protegite.

Per contra, le homines son vocate a confessar lor culpa e a revelar, in fundo a lor conscientia retrospective, un «comportamento inappropriate» que illes haberea potite haber dece, vinti o trenta annos retro, e de cuje illes deberea repentir se. La confession public, le incursion de auto-proclamate procuratores in le sphera private, ecce que installa como un climate de societate totalitari.

Le unda purificator non pare cognoscer alcun limite. Ibi, on censura un nudo de Egon Schiele sur un affiche; ci, on appella al retiro de un pictura de Balthus ab un museo, per motivo que il esserea un apologia del pedophilia; in le confusion del homine e del obra, on demanda le interdiction del retrospectiva de Roman Polanski al cinematheca e on obtene le prolongation de illo consecrate a Jean-Claude Brisseau. Un universitario judica le film Blow-Up, de Michelangelo Antonioni, «misogyne» e «inacceptabile». Al luce de iste revisionismo, John Ford (La Prisonnière du désert) e mesmo Nicolas Poussin (L’Enlèvement des Sabines) non duce al largo.

Jam, alcun editores demanda a certes de nos de render nos personages masculin minus «sexista», de parlar de sexualitate e de amor con minus dismesura o ancora de facer in modo que le «traumatismos subite per le personages feminin» sia rendite plus evidente! Al margine del ridiculo, un projecto de lege in Svedia vole imponer un consentimento explicitemente notificate a tote le candidates a un reporto sexual! Ancora un effortio e duo adultes qui habera desiderio de se mitter a lecto insimul debera previemente marcar de unsigno, via un «application» de lor telephono, un documento in le qual le practicas que illes accepta e los que illes refusa sera debitemente listate.

/em/boldLe indispensabile libertate de offender bold/em/

Le philosopho Ruwen Ogien defendeva un libertate de offender indispensabile al creation artistic. Mesmo, nos defende un libertate de importunar, indispensabile al libertate sexual. Nos es hodie sufficientemente avertite pro admitter que la pulsion sexual es per natura offensive e salvage, ma nos es anque sufficientemente clarividente pro non confunder le corte inhabile e le aggression sexual.

Ante toto, nos es consciente que la persona human non es monolithic: un femina pote, in le mesme jornata, diriger un equipa professional e gauder de esser le objecto sexual de un homine, sin esser un «canalia», ni un vil complice del patriarchato. Illa pote veliar a fin que su salario sia equal a illo de un homine, ma non se sentir traumatisate a jammais affrontar un fricator in le metro, mesme si illo es considerate como un delicto. Illa pote mesmo lo considerar como le expression de un grande miseria sexual, vider como un
non-evenimento.

In tanto que feminas, nos non recognosce nos in iste feminismo qui, alteremente del denunciation del abuso de poter, prende le connotationes de un odio del homines e del sexualitate. Nos pensa que la libertate de dicer no a un proposition sexual non existe sin la libertate de importunar. E nos considera que il es necesse saper responder a iste libertate de importunar sin se clauder al rolo de preda. 

Pro illas de nos qui ha eligite de haber infantes, nos estima que il es plus judiciose de elevar nos filios de maniera que illes son sufficientemente informate e consciente pro poter viver plenmente lor vita sin se lassar intimidar, ni patir un sentimento de culpabilitate.

Le accidentes que pote concerner le corpores de un femina non attinge necessarimente su dignitate e non debe, mesmo si isto pote ser a vices dur, necessarimente facer de illa un victima perpetue. Proque nos non es reducibile a nostre corpores. Nostre libertate interior es inviolabile. E iste libertate que nos ama non es sin riscos, ni sin responsabilitates.

Les redactrices de ce texto son: Sarah Avar (scriptrice, psychologo clinic e psychoanalysta), Catharina Milio (critic de arte, scriptrice), Catharina Robbe-Grillet (actrice de comedia e scriptrice), Peggy Sastre (autor, jornalista e traductrice), Abnousse Shalmani (scriptrice e jornalista). Adhere equalmente a iste tribuna: Kathy Alliou (curatrice), Marie-Laure Bernadac (conservator general honorari), Stéphanie Blake (autor de libros pro infantes), Ingrid Caven (actrice e cantatrice), Catharina Deneuve (actrice), Gloria Friedmann (artista plastic), Cécile Guilbert (autor), Brigitte Jaques-Wajeman (director de scena), Claudine Junien (geneticista), Brigitte Lahaie (actrice e presentatrice radio), Nathalie Legier (scriptrice e directrice general del Institut mémoires de l’édition contemporaine), Elisabeth Lévy (directrice del redaction de Causeur), Joëlle Losfeld (editrice), Sophie de Menthon (presidente del movimento ETHIC), Maria Sellero (autor, presidente del Société des gens de lettres).

/boldFonte: Le Monde. Fonte: www.kassataya.combold/

Traducite a interlingua per /boldCarmelo Serrainobold/ 13 jan. 2018</texto>
    </contento>
</documento>