<?xml version="1.0" encoding="utf-8"?>
<!DOCTYPE documento SYSTEM "../document.dtd">
<documento>
    <typo>Traductiones</typo>
    <data>20180104</data>
    <incatenar>
        <vade>http://interlingua.pedroruizhidalgo.es/documento/platero_3</vade>
        <veni>http://interlingua.pedroruizhidalgo.es/documento/platero_1</veni>
    </incatenar>
    <taxinomia>Paisage rubie</taxinomia>
    <autores>
        <autor>
            <nomine>Pedro Ruiz Hidalgo</nomine>
            <retes>@pedroruizhidalg</retes>
            <retes>interlingua@pedroruizhidalgo.es</retes>
        </autor>
    </autores>
    <contento>
        <titulo>Platero e io</titulo>
        <imagine>https://interlingua.pedroruizhidalgo.es/assets/image/platero_2.jpg</imagine>
        <texto>Le culmine. Ibi es le poner del sol, tote purpuree, ferite pro su proprie crystallos, que face le sanguine por ubicunque. A su splendor, le pineto verde on face acerbe, vagemente rubifacite; e le herba e le floretto, incendite e transparente, imbalsama le instante seren de un essentia molliate, penetrante e luminose.</texto>
        <texto>Io permane ecstasiate in le crepusculo. Platero, rubie de poner del sol su oculos nigre, on va, mansuete, a un cavo de aqua carminee, de rosa, de violetto; affunda suavemente su bucca in le speculos, que pare que on face liquide al toccar lo ille; e ha pro su enorme gorga como un passar profuse umbrose aquas de sanguine.</texto>
        <texto>Le localitate es cognoscite, sed le momento disordina lo e lo face estranio, ruinose e monumental. On dicerea, a cata instante, que nos va a discoperir un palatio abandonate... Le postmeridie on prolonga plus illac de illa mesme, e al hore, contagiate de eternitate, es infinite; pacific, insondabile...</texto>
        <texto>â€”Cammina Platero...</texto>
    </contento>
</documento>