<?xml version="1.0" encoding="utf-8"?>
<!DOCTYPE documento SYSTEM "../document.dtd">
<documento>
    <typo>Romanica</typo>
    <data>20180115</data>
    <incatenar>
        <vade>https://interlingua.pedroruizhidalgo.es/documento/mandala_2</vade>
        <veni>https://interlingua.pedroruizhidalgo.es/leger</veni>
    </incatenar>
    <taxinomia>Orientar se con una mappa mental</taxinomia>
    <autores>
        <autor>
            <nomine>Herminio Latone</nomine>
            <retes> Vivacchiananda</retes>
        </autor>
    </autores>
    <contento>
        <titulo>COGNOSCER LO BUDDHISMO A PARTIR DE UN DIAGRAMMA</titulo>
        <imagine>https://interlingua.pedroruizhidalgo.es/assets/image/mandala1.jpg</imagine>
        <texto>Observamos ista pictura o mandala, etiam si mandala est solmente uno appello conventional, initiamos a vider lo como un designo o una mappa, proque de illo se tracta.
        Considerando alora iste diagramma como una mappa, la prima cosa a facer est comprehender cello que son los symbolos, ni plus ne minus como se facet con una clave al pede della pagina.

Le panorama non est celestial, illo est simplicemente un panorama terrestrial, typic dellos locos de ubi provenet (Tibet), ce son etiam le sol e la luna a demonstrar le caracter mondan, toto isto stat a significar que istas cosas son humanas.

Nelle portion superior il han tres figuras, illas stan a significar uno concepto fundamental, le transformation delle mente, della parola et dello acto.

/titLe mente sta nello medio.tit/
Desde une mente ben controllate et developpate il haberan parolas et actos qui apportaran beneficios alle hommine sage et alles hommines proximes a ille.

Los beneficios seran in ista existentia proque solmente dum ista vita nos potemos contolar le nostre mente.

Complir un percurso de tranformation (in melio), secundo lo buddhismo, non est un action passive e por obtener dellos resultatos se debet laborar, mesmo alle labor ordinari que, si facite ben, apportarat gaino monetari.

Por facer lo ben on debet apprehender uno methodo, uno methodo lo qual ha essito projectato como apto allo objectivo  e sullo qual, solmente le «laborator» potet dicer la ultima parola.

Le recercator, alsi, trovarat plures methodos dum les sues investigationes, proque lo concepto de base est applicabile a plures formas explicativas.

Lo objectivo est aquello de mutar los pensamentos negativos in pensamentos positivos, inde reducer o eliminar las parolas e los actos negativos.

Isto conduce a un melior relation inter nos e lo universo qui ce imbraciat e le elimination de multes sufferentias delles quales nos mesmos essemos la causa.

Le comprehension de isto mechanismo est communemente appellato eveliamento e lo suo plus alto scopo est le liberation delle hommine desde las sufferentias, o plus correctemente, desde les sues afflictiones.

Les personages colorates de isto mandala non son divinitate, illes son «statos» mentales delles hommines, cata una est uno stato mental e lo suo opposito in se mesmo, aquello sin controllo e aquello controllato qui co-existen.

Antea de vader a explicar las sequentes figurettas il hat a dicer que, como se potet haber una mappa desegnata, on potet haber etiam una mappa «parlata» quando il hat le necessitate a rememorar los conceptos qui videremos.

Facer lo est multo simplice, se associat cata una figura/concepto con una paroletta conventional, isto systema que non habet nihil de mysterioso o magico est appellato mantra, un mantra non est un invocation ot un oration, illo est, como dicito, una mappa parlante.

Allas figuras de ja explicatas se associan istas parolettas:
/center /em Om     (le mente)
      Ah       ( la parola) 
    Hum     (lo acto)  em/ center/
Facite iste introduction, /boldvamos a vider las figurettas plus grandasbold/.</texto>
        
    </contento>
</documento>