<?xml version="1.0" encoding="utf-8"?>
<!DOCTYPE documento SYSTEM "../document.dtd">
<documento>
    <typo>Traductiones</typo>
    <data>20180115</data>
    <incatenar>
        <vade>https://interlingua.pedroruizhidalgo.es/documento/protocollos_1</vade>
        <veni>http://interlingua.pedroruizhidalgo.es/leger</veni>
    </incatenar>
    <taxinomia>Sages de Sion, Introduction</taxinomia>
    <autores>
        <autor>
            <nomine>Pedro Ruiz Hidalgo</nomine>
            <retes>@pedroruizhidalg</retes>
        </autor>
    </autores>
    <contento>
        <titulo>Protocollos del 
sages de Sion: Introduction</titulo>
        <imagine>https://interlingua.pedroruizhidalgo.es/assets/image/sages.jpg</imagine>
        <texto>Protocollos del sages de Sion es un documento fundamental que pone in evidentia le plan de domination mundial pro parte del Judeos. Habeva numerose debattos re le origine de iste documento. Varie expertes concorda in que esseva create in 1897, in le prime congresso sionista celebrate in Basel. Altere affirma que ha essite create  in un session secrete de sages judee que habeva essite effectuate in iste epocha. Le presse judee ha dismentite ista veritate usque ridiculisar le. Il es in nos, esser infidel al legato que illes nos lassava le expertes in le thema. Non es question de creder cecamente, nec vider e corroborar que la intention del sionismo pro dominar le mundo on repete in tote le epochas e in omne paises del mundo. Protocollos del sages de Sion es dividite in 24 partes o protocollos. Ille parla re ipse mesme. Il es multo importante cognoscer le significato del alicunos terminos usate in este documento:

/boldGoimbold/: (singular: Goy) Parola hebree usate in forma despectose pro referer se al non gentil (non judee) e que significa bestial.
Sionismo / Sionisme: Movimento mundial pro le avantiar e custodia del interesses politic-economic del judeos.

/boldGentilbold/: Vider Goim.

/boldMasoneriabold/: Actualmente es societates secrete que travalia misteriosemente in le umbra, empleante omne classe de artifices subterranee. In lor major parte iste organisationes es integrate pro le judee, tanto in le cupula como in lor differente hierarchias o grados .

/boldFrancmasoneriabold/: Organisation aristocratica intra del masoneria, le qual es ric e poterose. Il es protegite pro le soveran, cuje membros es admittite in le corporation post un initiation, sequite de provas moral e physica. Iste secta ha le discretional de eliminar secrete o publicamente a qui non considera apte.</texto>
    </contento>
</documento>