<?xml version="1.0" encoding="utf-8"?>
<!DOCTYPE documento SYSTEM "../document.dtd">
<documento>
    <typo>Traductiones</typo>
    <data>20180105</data>
    <incatenar>
        <vade>http://interlingua.pedroruizhidalgo.es/documento/platero_4</vade>
        <veni>http://interlingua.pedroruizhidalgo.es/documento/platero_2</veni>
    </incatenar>
    <taxinomia>Gaudio</taxinomia>
    <autores>
        <autor>
            <nomine>Pedro Ruiz Hidalgo</nomine>
            <retes>@pedroruizhidalg</retes>
            <retes>interlingua@pedroruizhidalgo.es</retes>
        </autor>
    </autores>
    <contento>
        <titulo>Platero e io</titulo>
        <imagine>https://interlingua.pedroruizhidalgo.es/assets/image/platero_3.jpg</imagine>
        <texto>Platero joca con Diana, le belle can feminin que on pare al luna crescente, con le vetule capra, gris, con los infantes...

Salta Diana, agile e elegante, ante le asino, sonante su breve campanetto, e face como que le morde su muso. E Platero, ponente le aures alte, qual duo cornos de cacto, ille hasta le blandemente, e face la rodar super le herba en flor.

Le capra vade al latere de Platero, racente a su gambas, trahente, con su dentes, del puncta del stoffa del carga. Con un floretto o un margarita en le bucca, on pone ante el, le chocca con le fronte, e depost salta, e bala gaudiosemente, caressabile eque un femina...

Inter le infantes, Platero esse un joculo. Con que patientia suffre lor follias! Como vade lentemente, stoppante se, on face el orate, pro que illos non cade! Como los espaventa quando initia, subitemente, un false trottar!
â€¦...........................

Clar postmeridie del autumno moguerese1! Quando le aere pur de octobre affila le immaculate sonos, on altia del valle un agitation idyllic de balamentos, hinnimentos, de risos de infantes, latratos, e campanettas</texto>
        
    </contento>
</documento>