<?xml version="1.0" encoding="utf-8"?>
<!DOCTYPE documento SYSTEM "../document.dtd">
<documento>
    <typo>Traductiones</typo>
    <data>20180116</data>
    <incatenar>
        <veni>https://interlingua.pedroruizhidalgo.es/leger</veni>
    </incatenar>
    <taxinomia>Dust in the wind</taxinomia>
    <autores>
        <autor>
            <nomine>Pedro Ruiz Hidalgo</nomine>
            <retes>interlingua@pedroruizhidalgo.es</retes>
            <retes>@pedroruizhidalg</retes>
        </autor>
    </autores>
    <contento>
        <titulo>Pulvere in le vento</titulo>
        <imagine>https://interlingua.pedroruizhidalgo.es/assets/image/dust_in_the_wind.jpg</imagine>
        <texto>Io claude le oculos
sol per un momento
e le momento passa.

Tote mi somnos
passa fronte de mie oculos:
un curiositate.

/bold/emPulvere in le vento,
omne que nos esse, es pulvere in le vento.em/ bold/

Como en un vetule canto,
sol un gutta de aqua
en un mar immense.

Le mesme vetule canto,
sol un gutta de aqua
en un immense mar.
Omne que nos face,
on cade,
benque no no vole vider lo.

/bold/emPulvere in le vento,
omne que nos esse, es pulvere in le vento.em/ bold/

Que tu non resiste,
nihil es per sempre,
ma le Terra e le celo.
Il on escappa 
omne tu pecunia
non pote comprar un minuto.

/bold/emPulvere in le vento,
omne que nos esse, es pulvere in le vento.em/ bold/
/bold/emPulvere in le vento,
omne que nos esse, es pulvere in le vento.em/ bold/

/link"https://www.youtube.com/watch?v=2-I-BhaiTzw"/l_Audi "Dust in the wind" in Youtubel_/ link/

</texto>
        <texto>/img"https://interlingua.pedroruizhidalgo.es/assets/image/kansas.jpg"img/
            /smallFonte poesia: /boldKansas.bold/ small/</texto>
    </contento>
</documento>