<?xml version="1.0" encoding="utf-8"?>
<!DOCTYPE documento SYSTEM "../document.dtd">
<documento>
    <typo>Traductiones</typo>
    <data>20180115</data>
    <incatenar>
        <vade>https://interlingua.pedroruizhidalgo.es/documento/protocollos_5</vade>
        <veni>https://interlingua.pedroruizhidalgo.es/documento/protocollos_3</veni>
    </incatenar>
    <taxinomia>Sages de Sion, Protocollo IV</taxinomia>
    <autores>
        <autor>
            <nomine>Pedro Ruiz Hidalgo</nomine>
            <retes>@pedroruizhidalg</retes>
        </autor>
    </autores>
    <contento>
        <titulo>Protocollo IV</titulo>
        <imagine>https://interlingua.pedroruizhidalgo.es/assets/image/sages.jpg</imagine>
        <texto>/boldDiverse phases de un republica. Action occulte del logias. Libertate e fide. Concurrentia international del commercio e industria. Le speculation. Culto al auro.bold/

Omne republica experimenta diverse periodos. Initia se como un ceco que fulla quanto es a su passo. Post illo, aperi se passo al demagogo que face germinar le anarchia e cultiva lo con finalitate de collectar le despotismo; non on tracta de un despotismo official, nec coperite. Sed il on lassa sentir. Generalmente, le fulla es dirigite pro alicun societate secrete que, occultate post su agentes, on monstra audace e sin scrupulos. Iste poter vadera a locar su agentes ubi melior conveni. Decite cambios correspondera al appetentia de disembarassar se de vetule servitores cuje servicios resulta jam costose.

Qui potera disthronar un poter occulte? Nostre fortia es invisibile. Le logia masonic servi pro occultar nostre planes. Le uso que no face de iste poter, equemente que le implaciamento de nostre quartieros general, sempre essera ignorate pro le public.

De esser bassate in le religion, in le fide in Deo e in le fraternitate human, le libertate poterea ser inoffensive; si libertate distacca ideas de equalitate, que contradice leges del creation (que a su vice stabili subordination), poterea exister in le governamento sin ser prejudicial al prosperitate del populo. Con tal fide, le populo lassarea governar pro le parochias e marcharea humile e tranquillo base le gerentia de lor pastores spiritual, submittite in le terra al divin providentia. Pro illo il es necessari accender del spirito del christian le conception mesme de Deo, substituente lo pro calculos arithmetic e pro necessitates material del vita.

Pro no eveliar suspiciones del christian a proposito de nostre politica, il es precise intertener illos e appellar su attention del loco del commercio e del industria. De ille forma, le nationes luctara pro su interesses particular, sin notar le tracia del inimico commun. Sed, pro que libertate pote disaggregar e ruinar le vita social del gentiles, il es necessari stabilir le speculation. De ille forma, on consequera evitar que gentiles retene ricchessa procedente del production del solo e del industria. Pro via del speculation, omne economia cadera in nostre manos.

Le lucta pro le suprematia e le chocs in le mundo del negotios creara un societate disincantate, egoistic e sin corde. Ille societate sentira indifferentia pro le religion e un profunde repugnantia pro le alte politica. Su guida essera le calculo e su culto al passion del auro. Homines facera omne fortias inimaginabile pro consequer le sparnio que pote proportionar illes le benes material. Tunc, le classe inferior de christian on unira in contra de nostre rivales plus intelligente; Illes non facera lo pro ideales, non mesmo pro desiros de ricchessa, illes facera pro odio al classes accommodate.</texto>
    </contento>
</documento>