<?xml version="1.0" encoding="utf-8"?>
<!DOCTYPE documento SYSTEM "../document.dtd">
<documento>
    <typo>Traductiones</typo>
    <data>20180115</data>
    <incatenar>
        <vade>https://interlingua.pedroruizhidalgo.es/documento/protocollos_13</vade>
        <veni>https://interlingua.pedroruizhidalgo.es/documento/protocollos_12</veni>
    </incatenar>
    <taxinomia>Sages de Sion, Protocollo XII</taxinomia>
    <autores>
        <autor>
            <nomine>Pedro Ruiz Hidalgo</nomine>
            <retes>@pedroruizhidalg</retes>
        </autor>
    </autores>
    <contento>
        <titulo>Protocollo XII</titulo>
        <imagine>https://interlingua.pedroruizhidalgo.es/assets/image/sages.jpg</imagine>
        <texto>/boldLibertate secundo judeo-masoneria. Pressa sub poter judeo-masonico. Controlo de pressa. Progresso secundo francmasoneria. Transcendentia del pressa. Solidarietate inter masoneria e pressa actual. Inflammation del exigentias social provincial. Infallibilitate del nove regime.bold/

Nos definira del sequente forma le parola libertate (proque pote esser interpretate de diverse formas). Libertate es le derecto a facer lo que permitte le lege. In nostre die, tal interpretation collocara omne libertate in nostre manos; secundo le programma exponite, leges demolira o instituera lo que nos conveni.

Con pressa nos operara del sequente modo: que papiro representa actualmente le pressa? Illo servi pro incender le passiones e mantener le egoismos partitario. Il es vacue, injuste, fabulator, e majoritate de personas non comprehende su utilitate. Nos sigillara illo e ponera freno, como nos facera con resto de opera impresse: De que servira disfacer nos del pressa si nos es le scopo del resto de publicationes e de libros? Nos transformara le publicitate, que ora es tan dispendiose; il es gratias a ille que nos pote censurar le jornales. Nos establira un imposto special pro le pressa. Requirera nos un participation in le profitos de quotidianes e editoriales. Assi, nostre governamento essera a salvo del attaccos del pressa. Opportunmente, nos imponera mulctas immisericordemente. Tanto mulctas como impostos ingrossara le coffros del stato.

Il es certe que quotidianes del partitos poterea resultar plus perniciose que le perdita de su moneta; de ser assi, nos expungera a radice de su secunde accurrer. Nemo habera macular le mytho de nostre infallibilitate governamental. Pro expunger un quotidian, nos dicera que agita le animos sin ration nec motivo.

On habera de notar que, inter le quotidianos que nos attacca, habera multo create per nos mesme. Istos attaccara exclusivemente le punctos que nos desira modificar.

Sin nostre approbation, nihil sera communicate al societate. Isto ultime ya on ha attingite. Hodie, notitias de omne partes del mundo es recipite per diverse agentias que centralisa las. Ille agentias es purmente nostre e revela solmente lo que nos permitte publicar.

Actualmente, nos ha sapite captar del animo del societates christian de tal modo que, in omne partes, mira le eventos mundial trans nostre prismas que nos colloca ante lore oculos. Jam non ha muros in nemo stato que impedi nos entrar a le que christianos denomina stupidemente secrete de statos. Que sera quando nos sia dominos recognoscite del universo in le persona de nostre rege universal?

Qui inter nos ignora que benes illusori conduce directemente al somnos absurde? De tal somnos on ha originate le relationes anarchic del homines inter ipse e con le poter. Le progresso, o melior dicite, le representation de illo ha propitiate ideas de multiple e illimitate emancipationes.

Omne aquelle que nos appella liberal es anarchista, si ben non de facto, al minus de pensamento. Protestante pro le unic placer de susurrar, illes perseque le illusiones del libertate e cade in le anarchia.

Que nos torna al pressa. Nos imponera taxas como a omne quanto sia imprimite. Essera impostos ascendente secundo el numero de papiros. Publicationes de minus de trenta paginas, registrate como brochures, parara duple de tributos; on cerca assi, per un loco, reducer le numero de brochures, que es le pejor del venenos, e, per altere loco, obligar al scriptores a producer libros tan longos e caros que sia pauco legite. Per contra, celles que nos edita pro le ben commun e con le tendentia stabilite essera economic e legite per totes. Impostos finira con vacue desiro de scriber, e medo a sanction submittera al litteratos.

Si alicun volve su penna contra nos, non trovara qui vole imprimer su scriptos. Antea de consentir imprimer un opera, le editor o impressor consultara al autoritates a fin de obtener autorisation necessari. De iste modo, nos cognoscera anticipatemente le imboscadas que nos face e contraattaccara nos, mediante explicationes con antecedentes re le caso tractate.
Litteratura e jornalismo es le medios educative plus importante. Per illo, nostre governamento sera le proprietari del majoritate del quotidianes. Assi, le influentia perniciose del pressa particular sera neutralisate e nos obtenera un autoritate enorme super le public. Si nos autorisa le publication de dece quotidianes, nos fundara trenta del nostre.
Quotidianes que nos edita sera, apparentemente, de tendentias e opiniones opponite. Illo habera de inducer confidentia a omnes e habera de attraher, sin suspicion, a adversarios que cadera in le trappa e devenira inoffensive.

In prime loco, nos displicara le organos de character official; ille sempre velera per nostre interesses e non nos habera de mancar le somno. In secunde loco, collocara nos le officiose, cuje papiro sera el de attraher al indifferente e al amorphe. In tertie loco, installara al pretense opposition: al minus un quotidian collaborara con nos como antipoda de nostre ideas. Nostre adversarios prendera a ille false oppositor como su alliate e revelara a nos mediante ille.

Nostre quotidian sera de omne tendentias: aristocratic, republican, revolutionari, e usque anarchic; Isto, naturalmente, intertanto dura le constitution. Tenera, como le deo hindu Visnu, cento manos, cata un del qual accelerara le transmutation del societate. Iste manos conducera le opinion como melior sia conveniente a nostre interesses (un homine alterate perde la facultate de rationar e on abandona facilemente al suggestion). Imbecille qui crede sequer le opinion de su partito repetera nostre opinion, o qual nos conveni. On videra sequente al organo de su partito sin saper que, realmente, escorta le bandiera que nos porta ante lore oculos.

Pro gerer in iste rumbo a nostre exercito de jornalistas, nos organisara iste labor cautemente. Sub le nomine de Bureau Central del Pressa, nos stabilira reuniones litterari ubi nostre agentes dara, sin suspicion de nemo, le parola de ordine e normas. Discutente e contradicente nostre initiativas de un forma superficial, sin penetrar el fundo del question, sustenera inutile polemicas con le jornales official a fin de procurar medios de pronunciar nos plus clarmente, qualcosa que no es conveniente facer durante le prime declarationes official.
Istos attaccos servira, in plus, pro que nostre vassallos judica garante le libertate de parola. Assi, nostre agentes possedera pretextos pro affirmar que qui nos impugna es un charlatan sin argumentation pro refutar seriemente nostre projectos.

Tal processos, non advertite pro le opinion public, sed secur, nos trahera certemente attention e confidentia public. Gratias a illos, nos agitara o calmara le animos in questiones politic secundo sia necessari, convincente o suscitante dubitas, publicante le veritate o falsitate, confirmante o contradicente secundo le effecto desirate, sed comparante sempre le terreno que nos habera de calcar.

Nos vincera a nostre adversarios proque illos non disponera de organos que pote reger le opinion usque ultime consequentias, como nos. No tenera, non mesmo, necessitate de longe e profunde refluctuationes. In caso de necessitate, nos refutara energicamente in le pressa officiose le globos de essayo lanceate per nos mesme in le tertie categoria de nostre pressa.
In iste momento, existe jam solidarietate francmasonic intra del jornalismo francese. Omne organos del pressa es ligate inter ipse pro le secrete professional; como vetule augures, nemo de su integrante revelara le secrete sin reciper ordine de facer lo. Necun jornalista osara trair iste secreto, jam que no serea admittite al profession qui non tene in su passato alicun manco de serietate vergoniose: in caso de infidelitate, ille macula sera immediatemente revelate. Durante que ille stigmas sia cognoscite solmente pro un pauco, le aureola del jornalista sequera attrahente nos le opinion del majoritate qui seque ille con enthusiasmo.

Durante que non nos disfructa del poter absolute, nos tenera necessitate de fullar capitales con opiniones del populo provincial, es dicer, pro le majoritate manipulate pro nostre delegate. Il es necessari que in capitales, in momento critic, non on discute le facto consummate per haber essite jam acceptate pro le majoritate provincial.

Quando nos passa al nove regime que prepara le arrivate de nostre regno, nos potera tolerar le revelation del dishonestitate public pro le pressa. Sera necessari que on crede que le nove regime satisface de tal modo a tote que usque le crimines disparere. Le casos de manifestationes criminal cognoscite solmente pro le victimas e testes presential.
</texto>
    </contento>
</documento>