<?xml version="1.0" encoding="utf-8"?>
<!DOCTYPE documento SYSTEM "../document.dtd">
<documento>
    <typo>Scriptes de autor</typo>
    <data>20180116</data>
    <incatenar>
        <veni>https://interlingua.pedroruizhidalgo.es/leger</veni>
    </incatenar>
    <taxinomia>Stato de Maxime Incompetentia</taxinomia>
    <autores>
        <autor>
            <nomine>Pedro Ruiz Hidalgo</nomine>
            <retes>interlingua@pedroruizhidalgo.es</retes>
            <retes>@pedroruizhidalg</retes>
        </autor>
    </autores>
    <contento>
        <titulo>Un situation real del politica en Espania</titulo>
        <imagine>https://interlingua.pedroruizhidalgo.es/assets/image/incompetencia.jpg</imagine>
        <texto>/titLe stato del maxime incompetentia.tit/

Il ha un burla communmente explicate in interprisas, super toto, in ambitos de computation. Ille es assi: en qualcunque interprisa es contactate un travaliator. Ille travaliator es bon, logicamente, el prospera. Su empleatores crede que el seque essente un bon travaliator que merita esser ascendite altere vice.  Assi continua le conto usque nostre homine arriva a tal posto in que ya non pote esser ascendite, ya non prospera. Ergo ille ultime posto de responsabilitate es su stato de maxime incompetentia.

Situation politica en Espania es regite per un pugnata de personas qui non pote esser ascendite.

Nos ha un rege, qui ha hereditate su posto perque su patre ha dimittite e lassate en hereditate. Realmente ille ha tenite necun governamento in Espania durate su regno. Io non parlara plus re iste persona perque io es de credentia republican: In Espania ha un lege que prohibe parlar contra le monarchia.

Etiam, ha un politico appellate Mariano Rajoy, del Partito Popular, qui ha essite presidente del governamento de Espania desde decembre de 2011 usque 11 decembre de 2015, date ubi comencia a exercer como presidente in functiones.

Altere actor in queste theatro burlesc es Pedro Sánchez, electe secretario general (presidente) del Partito Socialista post mal resultates de Alfredo Pérez Rubalcaba in electiones europee de 2014. El obtene la direction de su partito quando iste habeva le pejor resultato in su longe historia. Assi, Pedro Sánchez, ha un mission suicida, consistente en facer flotar altere vice a un partito. Benque, como secretario general, el sta circumferite e subjecto a presidentes de communitates autonomes qui mantene su posto con plus possibilitates de futuro que el mesme presidente del partito. Question que face a Sánchez presse de al hora de executar decisiones. Non obstante, Partito Socialista ha parite non distinguibile del politicas neoliberal en decennios.

Procedente de Catalonia, region que pretende su independentia del stato espaniol, Albert Rivera, del Partito Citatano, es contrari al separation de Catalonia de Espania. Il comenciava como un partito regional e saltava al ambito national con una nove derecta que totevia plus liberal que Partito Popular, pretende le libration de obligationes por parte del stato al citatanos. Per exemplo, pensiones, sanitate, justitia e education private. Assi, secundo mi impression, su politica pote liberar al Stato de cargas economic.

Por ultime, Pablo Iglesias, professor de scientia politica de Universitate Complutense, e vetule militante de partitos e associationes de sinistra, comencia su action post movimento appellate «15M» ubi le populo espaniol on lanceava al strata pro demandas de plus democratia, libertate, digne salarios e conditiones socio-economic melior. 

Partito de Pablo Iglesias es appellate Podemos (/emNos poteem/), benque ille partito ha concurrite juncte a Izquierda Unida al ultimas electiones. Izquierda Unida es un coalition de partitos de sinistra que ha essite aggruppate en iste organisation post le fracasso del euro communismo.

Con istes personas e positiones, Espania convoca un secunde convocato de electiones general en 26 de junio del presente anno 2016. Importante saper que habeva altere electiones general el 20 de decembre de 2016. Iste es fallite e non ha essite possibile formar un governamento.

In Constitution espaniol rege es qui designa a un deputato pro formar governamento. Sed, nostre constitution non es presidential, io vole dicer, es le Congresso del Deputatos qui debe designar e seliger al presidente del Governamento, que a su vice, debe esser proponite por le rege. Traditionalmente, benque nostre democratia ha quaranta annos plus o minus, sempre qui a essite designate pro le rege ha potite formar governamento debite al traditional  bipartitismo essente usque annos septanta. 

Sed le nove situation a cambiate. Le nove situation politica face que el populo on pronuncia sin majoritates pro formar governamento al vice que politicos non comprehende ille nove situation.

In passate, le partitos Popular e Socialista, ha alternate governamento con adjuta, caso de esser necessari, con adjuta (basse concessiones politicas e social) de partitos catalanes e bascos, adjuta (concessiones) que ora non es possibile jam que le irruption del nove actores politic propitia un situation ubi non ha majoritates, ergo, politicos debe altiar accordos, cosa pro que ille ha demonstrate un total incapacitate.

Effectivemente ha un divortio inter populo e sue governantes. 

/boldSi, iste es le stato me maxime incompetentia.bold/
/smallAutor del texto:Pedro Ruiz Hidalgo.small/

</texto>
    </contento>
</documento>