<?xml version="1.0" encoding="utf-8"?>
<!DOCTYPE documento SYSTEM "../document.dtd">
<documento>
    <typo>Traductiones</typo>
    <data>20180115</data>
    <incatenar>
        <vade>https://interlingua.pedroruizhidalgo.es/documento/protocollos_10</vade>
        <veni>https://interlingua.pedroruizhidalgo.es/documento/protocollos_8</veni>
    </incatenar>
    <taxinomia>Sages de Sion, Protocollo IX</taxinomia>
    <autores>
        <autor>
            <nomine>Pedro Ruiz Hidalgo</nomine>
            <retes>@pedroruizhidalg</retes>
        </autor>
    </autores>
    <contento>
        <titulo>Protocollo IX</titulo>
        <imagine>https://interlingua.pedroruizhidalgo.es/assets/image/sages.jpg</imagine>
        <texto>/boldApplication del principios masonic pro imponer doctrina al populos. Destruction del poteres regnante. Importantia del atheismo. Dictatura del judeo-masoneria. Le terror. Servitores del judeo-masoneria. Conflicto inter le poter e le populo. Communitate de poter con le populo. Arbitrarietate liberal. Corruption del goim e su leges. Interpretation del leges. Metropoli.bold/

Al applicar le principios, vos tene que coler en cognoscer le character particular del nation, en cuje sino vos va a operar. Un application general e uniforme de principios no recoltara exito antes de que le education del nation en question ha essite regulamentate. Sed, applicante prudentemente nostre principios, vos discoperira que, in minus de dece annos, celle populo, pro obstinate que ha essite, se transformara e submittera a nos.

Quando sia le momento, nos substituera le locution del ordine que nos ostenta como divisa masonic Libertate, Equalitate e Fraternitate no por altere parolas, nec pro le mesme parolas transformate en ideas. Nos dicera: Le derecto al libertate, le deber de equalitate e le ideal del fraternitate; de ille modo, nos tenera incatenate al monstro. De facto, jam nos habera destruite onme governamentos del mundo, excepto le nostre, benque in theoria totevia remane alicunos pro destruer.

Actualmente, si alicun governamentos altia protestas contra nos, face lo pro pure formalismo e con nostre consentimento, pro que nos precisa de lor antisemitismo pro governar a nostre fratres minor e mantener cohesion inter illos. Non crede io necessari tractar exhaustivemente iste subjecto que jam ha essite scopo de innumerabile discutiones.

 In resume, nos non tene obstaculos in le camino. Le situation del governamento universal ante le lege es tanto robusta que un parola indica lo omne: Dictatura. Ego pote affirmar que in le momento actual nos es legislatores, nos dicta penas, nos sententia a morte o nos pardona; nos es alco assi como le general in chef que marcha al capite de omne exercitos. Nos governara con mano firme e voluntate de ferro. Nos ha apoderate del remanente de un poterose partito que governava in altere tempore e que ora tene ben fixate. Nos habe ambitiones dismensurate, ardente coditia, venganza sin pietate e odio reconcentrate.

De nos forni le terror que omne invade. Nos dispone servitores de omne opiniones e omne doctrinas: restauratores de monarchias, demagogos, socialistas, communistas e utopistas de omne typo. Tote illos collabora con nos. Cata qual, a lor forma, mina le poter e sfortia se pro derruer quanto on mantene in pede. Omne statos suffre con ille perturbationes, demanda calma e, pro amor al pace, illes es disposite a facer sacrificios; sed non sera concedite tregua usque recognosce aperta- e humilemente nostre governamento supreme international.
Populos reclama angustiate que es necessari resolver le question social mediante pactos internationales. Le divisiones del populo en partitos situa a omne in nostre manos, pro que, pro sustener lor debatto, illes precisa moneta, e le moneta tene nos.

Nos poterea diffider un alliantia inter intellectualitate del gentiles e le fortia ceca del populo, sed nos ha acquirite mensuras contra tal eventualitate. Inter ambe potentias nos ha levate un muro de timor reciproco. De Ille modo, nos appoia in le poter ceco del massas. Nos sera su unic chefs e conducera ubi nos conveni.

A fin de que le mano ceca non pote liberar se de nostre direction, nos debe permaner in contacto directe con le massas, si non personalmente, al minus mediante nostre fratres plus fidel.  Quando nos sia un poter recognoscite, nos dirigera directemente al populo in le strata public e instruera in in questiones politic tanto como nos judica necessari.

Como verificar que on docera al infantes in scholas rural? Nos debe pensar que quanto dice le delegate del governamento, e usque le minime persona regnante, sera cognoscite in tote le nation e es natural que le voce del populo divulga lo immediatemente.

Pro non destruer prematurmente institutiones del christian, nos habe retoccate habilemente, appropriante nos del controlos de su mechanismo. Antea illos functionava basse un regime sever, sed justo; nos ha substituite pro le liberalitate disordinate. Nos tocca le justitia, electiones, pressa, libertate individual e, supertoto, instruction e education, que es le sustentamento del libere existentia.

Decipiente, nos ha brutalisate e corrumpite al generation actual del gentiles con un education fundate in principios e theorias false inculcate pro nos mesme. Nos ha procedite pro super del leges in vigor, sin cambiar le in su essentia; Nos ha disfigurate mediante interpretationes contradictori con que nos ha attingite prodigiose resultatos. Il on ha potite verificar ille resultatos: nostre interpretation occultava le senso ver del leges, que on deveniva non intelligibile, nec governamentos ha potite disimbroliar tal intrication.

De hic nasceva le theoria del tribunal de conscientia. On vole dicer, que in certe casos, non debe fixar se al littera del lege nec judicar con arrangiamento al conscientia.

Comprehende se que nationes poterea brandir armas contra nos si nostre planes esserea prematurmente discoperite. Sed, in tal caso, nos ponerea in action le fortia formidabile de que nos dispone, e nos disincatenarea un manovra tanto terribile que facerea tremer al animas plus temerari. Profitante le retes ferroviari e systemas de cloacas nos facerea volar le grande metropolis con lor institutiones e tote lor documentos de stato.
        </texto>
    </contento>
</documento>