<?xml version="1.0" encoding="utf-8"?>
<!DOCTYPE documento SYSTEM "../document.dtd">
<documento>
    <typo>Traductiones</typo>
    <data>20180115</data>
    <incatenar>
        <vade>https://interlingua.pedroruizhidalgo.es/documento/protocollos_12</vade>
        <veni>https://interlingua.pedroruizhidalgo.es/documento/protocollos_10</veni>
    </incatenar>
    <taxinomia>Sages de Sion, Protocollo XI</taxinomia>
    <autores>
        <autor>
            <nomine>Pedro Ruiz Hidalgo</nomine>
            <retes>@pedroruizhidalg</retes>
        </autor>
    </autores>
    <contento>
        <titulo>Protocollo XI</titulo>
        <imagine>https://interlingua.pedroruizhidalgo.es/assets/image/sages.jpg</imagine>
        <texto>/boldProgramma del nove constitution. Alicun detalios re colpo de stato proponite. Gentiles tractate como arietes. Francmasoneria secrete e su logias de faciadas.bold/

Consilio de Stato servira pro confirmar le poter del Governamento. Sub le apparentia del corpore legislative, sera, in realitate, un committee pro le redaction de leges e derectos del governante.
Hic es como nos elaborara le nove constitution. Nos creara le lege, le derecto e tribunal:
/bold1.bold/ Como responsas al corpore legislative.
/bold2.bold/ Pro derectos presidential in forma de ordines general, per actos del senato e pro mandatos ministerial que procede del consilio de stato.
/bold3.bold/ Si resulta opportuno, per colpo de stato.

Un vice planate iste approximate modus agendi, nos examinara mensuras que sia valide pro finir le transformation del Stato in le senso desirate. Ego on refere al libertate de pressa, al derecto de association, al libertate de conscientia, al principio effective e a altere themas que habera de disparer del repertorio human o ser radicalmente alterate in le nove constitution.
Arrivate iste momento, nos potera publicar de un vice le conjuncto de nostre dispositiones. Plus avante, qualcunque cambio appreciabile resulara pelicurose: de esser facite le cambio in un clima de rigurose severitate, pote provocar desperation ante le temor de nove modificationes del mesme senso. Si, per contra, on actua a favor de disapprobationes siguiente, dira se que nos es errate (illo maculara le aura de infallibilitate del nove poter) o que, per timor, nos ha facite justes concessiones (que nemo ha regratiate). In un o altere caso, on incontrarea compromitte le prestigio del recente constitution. Nos interessa que, desde le die de su proclamation, quando le populos es stupefacite ante le terror e le perplexitate illos recognosce que nos es tan torte, invulnerabile, e poterose, que nos non contara con illos. Nos subestimara sue opiniones e desiros, essente disponite e in conditiones de reprimer omne expression o manifestation de ille aspirationes e de ille opiniones. Nostre autoritate sera indiscutibile: nos habera appoderate de un colpo de omne quanto nos precisa e non compartira con nemo. Tunc, illos claudera le oculos e sperara le disveloppamento del evenimentos.
Christian es un grege de arietes, e nos es le lupo! Vos jam sape que succede quando lupo entra in le grege!
Claudera le oculos ante omne. Promittera nos restabilir libertates confiscate un vice que le inimicos del pace, equemente que omne gruppos, habera essite reducite al impotentia. No necessita ego clarer que sperara indefinibilemente le volta al passato.
Pro que dede vos que nos ha inventate e inspirate al christian omne iste politica sin permitter comprender illa? Pro que attinger secretemente lo que nostre racia disperse no poterea arrivar apertemente? Iste ha essite le base del francmasoneria secrete, cuje designos no suspecta le inepte christian, convocate per nos al armea perceptibile del logias pro distraher reguardos de su proprie fratres.
Deo ha date a nos, sue electe populo, le dispersion, e in iste debilitate on trova le fortia que propelle nos al limine del dominio universal. Manca jam pauco pro edificar super iste erection.</texto>
    </contento>
</documento>