<?xml version="1.0" encoding="utf-8"?>
<!DOCTYPE documento SYSTEM "../document.dtd">
<documento>
    <typo>Traductiones</typo>
    <data>20180115</data>
    <incatenar>
        <vade>https://interlingua.pedroruizhidalgo.es/documento/protocollos_9</vade>
        <veni>https://interlingua.pedroruizhidalgo.es/documento/protocollos_7</veni>
    </incatenar>
    <taxinomia>Sages de Sion, Protocollo VIII</taxinomia>
    <autores>
        <autor>
            <nomine>Pedro Ruiz Hidalgo</nomine>
            <retes>@pedroruizhidalg</retes>
        </autor>
    </autores>
    <contento>
        <titulo>Protocollo VIII</titulo>
        <imagine>https://interlingua.pedroruizhidalgo.es/assets/image/sages.jpg</imagine>
        <texto>/boldFraude in procedimentos. Collaboratores del judeo-masoneria. Nostre scholas special e su scopo. Economistas e millionarios. A qui on debe confider le postos importantes del governamento.bold/

Nos debe appropriar de omne instrumentos e medios que nostre adversarios pote emplear contra nos. Nos usara subtilitate de delicatessas del lingua juridic quando nos tene que pronunciar sententias osate o injuste. Il es necessari exprimer ille judicamentos in terminos que pare moral, rationabile e justo ante le populo.

Nostre governamento habera de incircular se del elementos plus poterose de aquelle civilisation ubi on debe mover se. In su milieu abundara publicistas, jurisconsultos, administratores, procuratores, diplomaticos... es dicer, homines preparate pro nos in scholas special.

Celle homines cognoscera le secretos del existentia social, le lingua politic, le sentimentos del corde human, e de su cordas plus sensibile (super celle habera de actuar multe vices). Iste cordas constitue le spirito del gentiles, su bon e mal qualitates, su tendentias e su vitios, le particularitates de classe e condition. Il permane ben intendite que collaboratores genial de nostre governamento no exira del gentiles, habituate a affectar su travalios administrative sin coler de su utilitate o finalitate. Administratores christian signa papiros que no lege e servi pro interesse o ambition.

Nos plenara nostre governamento de economistas. Scientias economic es le themas primordial que nos insenia al judeos. Nos tenera in nostre ambiente un universo de bancheros, industriales, capitalistas e supertoto, millionarios: al final le moneta decidera toto.

 Intertanto nos non es completemente secur de adjudicar illes le altos postos del governamento al judeos, nos nominara personas cuje antecedentes e reputation sia tan mal que ha facite un abysmo inter illos e le nation. Illes essera homines tal que, in caso de disobedir nostres ordines, tene que sperar un condemna o un exilio. Isto on facera con le objecto de obligar illes a defender nostre interesses usque le ultime consequentias.</texto>
    </contento>
</documento>