<?xml version="1.0" encoding="utf-8"?>
<!DOCTYPE documento SYSTEM "../document.dtd">
<documento>
    <typo>Traductiones</typo>
    <data>20180105</data>
    <incatenar>
        <vade>http://interlingua.pedroruizhidalgo.es/documento/platero_6</vade>
        <veni>http://interlingua.pedroruizhidalgo.es/documento/platero_4</veni>
    </incatenar>
    <taxinomia>Le primavera</taxinomia>
    <autores>
        <autor>
            <nomine>Pedro Ruiz Hidalgo</nomine>
            <retes>@pedroruizhidalg</retes>
            <retes>interlingua@pedroruizhidalgo.es</retes>
        </autor>
    </autores>
    <contento>
        <titulo>Platero e io</titulo>
        <imagine>https://interlingua.pedroruizhidalgo.es/assets/image/platero_5.jpg</imagine>
        <texto>Guai, que splendor e que odores!
Guai, como ride le pratos!
Guai, que canto matinal on audi!
			Romance popular.
        
        
        </texto>
        <texto>In mi dormitar matinal, me irrita un indiabolate clamor de infantes. Finalmente, sin poter dormir plus, io reposa me, desperado, en le lecto. Alora, al vider le campo trans le fenestra aperte, io comprehende que qui face le agitation es le aves.

Io exi al cortil e regratia al Deo del die blau. Libere concerto de beccos, fresc e sin fin! Le hirundine crispa, capriciose, su canto en le puteo; sibila le merla super le orange cadite; de foco, le oriolo balbutia in le robore; le passere, ride sovente e largemente in le culmine del eucalypto; e, in le grande pino, le canarios discute sin possessor.

Como esse le deman! Le sol pone in terra su gaudio de argenta e de auro; papiliones de cento colores joca por tote locos, inter le flores, por le domo, in le fontana. Ubicunque, el campo on aperi en detonationes, en strideres, en un bullir de vita san e nove.

Il pare que nos esse intro de un grande favo de luce, que esserea le interior de un immense e, calide rosa incendite.</texto>
        
    </contento>
</documento>