<?xml version="1.0" encoding="utf-8"?>
<!DOCTYPE documento SYSTEM "../document.dtd">
<documento>
    <typo>Traductiones</typo>
    <data>20180115</data>
    <incatenar>
        <vade>https://interlingua.pedroruizhidalgo.es/documento/protocollos_8</vade>
        <veni>https://interlingua.pedroruizhidalgo.es/documento/protocollos_6</veni>
    </incatenar>
    <taxinomia>Sages de Sion, Protocollo VII</taxinomia>
    <autores>
        <autor>
            <nomine>Pedro Ruiz Hidalgo</nomine>
            <retes>@pedroruizhidalg</retes>
        </autor>
    </autores>
    <contento>
        <titulo>Protocollo VII</titulo>
        <imagine>https://interlingua.pedroruizhidalgo.es/assets/image/sages.jpg</imagine>
        <texto>/boldScopo de altia de armas. Fermentation, luctas e discordia in omne le mundo. Submittente del gentiles verso de guerras interne e pro le guerra mundial. Secreto considerate como arte del politica e de judeo-masoneria. Pressa, opinion public e nostre triumpho. Seniores american, japonese e chinese.bold/

Intensification del servicio militar e augmento del fortias de policia es essential pro realisation del planes indicate.  Il es necessari que, extra de nostre orbita, le pais permane reducite a un grande massa proletari de ubi haurir individuos convertite in soldatos e agentes de policia submissos a nostre causa.

In tote Europa, e con le adjuta de Europa, nos debe suscitar in tote le resto de continentes le discordia, dissensiones e mutua hostilitate. Assi nos tenera un duple avantage: in prime loco, illos respectara nos in omne paises e assi illos sapera que nos pote, quando nos vole, provocar le disordine restabilir le ordine, per altere, omne statos accostumara a considerar nos como un carga necessari; in secunde loco nos involvera con intrigas al ministerios de tote governamentos, sia pro nostre politica o per medio del contractos commercial e obligationes financiari.

Pro attinger iste scopo, sera necessari recurrer a infinitate de insidias e artificios durante negotiationes e debattos; sed quando nos arriva a isto que es appellate le lingua official, nos adoptara le tactica opposite, fingente ser summemente honorabile e consiliator. De iste modo le governamentos del gentiles, a qui nos ha accostumate a vider unicamente le latere plus impressionante del negotios que es sempre nos ha presentate, nos considerara totevia le benfacente e salvatores del humanitate.

Nos ha de star preparate pro travaliar con qui on oppone a nostre projectos. Si il esserea necessari, que le pais vicino declara le guerra al nation que pretende blocar nos. Sed si ambe on reuni contra nos, tunc nos discatenara un guerra mundial.

In politica, le triumpho definitive depende essentialmente del reserva con que on ha protegite le plan a effectuar. Actos de un diplomatico non debe corresponder nunquam con su parolas.

Jam le projecto mundial on approxima al finales planate anteriormente. Pro attinger su exito total, nos necessita convincer al governamentos del gentiles per lo que vulgarmente on appella opinion public. Le criterio popular ha essite redisposto pro nos per le pressa: ille grande potentia es in nostre manos in quasi su totalitate.

Arrivara le momento de demonstrar que tote governamentos europee del goim es slavisate. Nos submittera a un de illos al grande proba de nostre poter. Nos on servira de ultrage e crimines, e nos servira del terror. Si esserea le caso que, indignate, le alteres on ponerea in contra nostre, nos responderea con le poteres bellic american, chinese o japonese.</texto>
    </contento>
</documento>